{
    "sales_id": "",
    "current_status": "",
    "created_by": "",
    "created_at": "",
    "updated_by": "",
    "updated_at": "",
    "ordered_at": "",
    "basic_info":
    {
        "customer":
        {
            "name": "",
            "department_type": "",
            "contractor": "",
            "source": "",
            "reaction": "",
            "new": false
        },
        "contact":
        {
            "name": "",
            "email": "",
            "phone": "",
            "position": ""
        },
        "requirement":
        {
            "description": "",
            "supply_date": ""
        },
        "status_history":
        [
            {
                "status": "",
                "updated_by": "",
                "updated_at": ""
            }
        ],
        "shipping":
        {
            "shipped_by": "",
            "shipping_code": "",
            "address": ""
        }
    },
    "history":
    [
        {
            "active": true,
            "sales_status": "",
            "created_by": "",
            "updated_by": "",
            "created_at": "",
            "updated_at": "",
            "comments":
            [
                {
                    "comment": "",
                    "created_by": "",
                    "created_at": ""
                }
            ],
            "kits":
            [
                {
                    "kit_id": "",
                    "kit_version": 0,
                    "kit_name": "",
                    "category": "",
                    "products":
                    [
                        {
                            "product_id": "",
                            "custom": false,
                            "product_version": 0,
                            "basic_info":
                            {
                                "product_name": "",
                                "category": "",
                                "description": ""
                            },
                            "spec":
                            {
                                "size": "",
                                "material": "",
                                "print": "",
                                "processing": ""
                            },
                            "manufacture":
                            {
                                "shop": "",
                                "duration": 0,
                                "cost": 0,
                                "price": 0
                            },
                            "items":
                            [
                                {
                                    "item_id": "",
                                    "item_name": "",
                                    "logo_type": "",
                                    "volume": 0,
                                    "amount": 0
                                }
                            ]
                        }
                    ]
                }
            ],
            "products":
            [
                {
                    "product_id": "",
                    "custom": false,
                    "product_version": 0,
                    "amount": 0,
                    "basic_info":
                    {
                        "product_name": "",
                        "category": "",
                        "description": ""
                    },
                    "spec":
                    {
                        "size": "",
                        "material": "",
                        "print": "",
                        "processing": ""
                    },
                    "manufacture":
                    {
                        "shop": "",
                        "duration": 0,
                        "cost": 0,
                        "price": 0
                    },
                    "items":
                    [
                        {
                            "item_id": "",
                            "item_name": "",
                            "logo_type": "",
                            "volume": 0,
                            "amount": 0
                        }
                    ]
                }
            ]
        }
    ]
}